title,url,source_name,date_found,actual_url,text
Serbia's students plan major rally after issuing 'ultimatum' - DW,https://news.google.com/rss/articles/CBMilAFBVV95cUxPTUNEczRfcmJoVmpFY2hHSFFOMnlsZkNfdWl3ZFl0QXY0UTJ3MDZ5WTViMFExV3plUGtTRVR2N1lIOGl6LVBZdXM1ZjRkbFh5MEk1ZHliUjE1VzgwckFzcklKXzdiQkxtWm9oY21oX0ZzUngtWlFGZU1mZ0p0OUlfa2IybFkxYzRTRU9KVEZ6bzVsYUxR0gGUAUFVX3lxTFBKYjQ0ZVlESXBaaEtLWmZiRzZVVXp6czVSQldBTlE3UFJCbDFQa1NVNTlwWEowNVBYRTNfSmFRcTRqSUV0aWdLVGZjVDAwMWJQVEJUTUZSNy1pZGNPRWZGQlJCMjZyb2dEdDY5bkRVMDdmMVY1cVR1N19aVy1zTzZsaUtpb2JxdlJRRHZGSUlHTGN4ZkI?oc=5,DW,2025-06-25,https://www.dw.com/en/serbias-students-plan-major-rally-after-issuing-ultimatum/a-73038449,"Faced with mounting pressure from the authorities, Serbia's students have issued an ""ultimatum"" to the government to call snap elections and are urging citizens to continue the push for change.

As Belgrade's asphalt shimmers in blistering 40-degree sunshine, the city is bracing for heat of a very different kind: Students have scheduled another major protest for Saturday.

All eyes are on the Serbian capital, and both anticipation and uncertainty across the country are rising as students remain tight-lipped about their plans and the exact location and timing of the demonstration.

The protest has the potential to be a turning point because the students have issued what they are calling an ""ultimatum"" to the Serbian government, demanding the announcement by 9 p.m. on June 28 that the government will ask the president to dissolve parliament, paving the way for snap elections.

""Should the stated demands not be met within the given timeframe, we expect that the citizens of Serbia will be ready to take all available measures of civil disobedience to protect their basic right to a free and legitimate democratic system,"" the students wrote in an open letter to the Serbian government.

Significant date for the protest

The upcoming protest comes after eight months of protests, during which students and citizens have demanded political and criminal accountability for the collapse last November of the canopy at the entrance to Novi Sad Railway Station, which killed 16 people.

Protesters gather outside the offices of the ruling SNS in Novi Sad to protest the official results of the local elections in Kosjeric and Zajecar, which were narrowly won by the SNS Image: Maxim Konankov/NurPhoto/picture alliance

The day chosen for the protest carries particular weight in Serbia.

Vidovdan is a national and religious holiday that falls on June 28. Deeply rooted in Serbian history and mythology, it has often coincided with decisive events and historical turning points in the country's history such as the 1389 Battle of Kosovo and a number of pivotal political events in the 20th century.

Universities under pressure

In the meantime, the government has increased pressure on universities.

For four months now, university professors have been surviving on one-eighth of their salaries as the government refuses to pay salaries for the period during which classes were halted due to student blockades.

The state insists that the unpaid salaries will only be paid once the missed classes have been made up. Universities are now scrambling to do that even as the blockades continue.

While some have shifted to online lectures, others are distributing reading material and hoping that students will manage on their own.

In institutions where practical skills are an essential part of the course, professors warn that these solutions are educationally and legally unacceptable.

""This is clear to professors pretending to teach, to students who are not participating in such teaching and most of all to the state that forced us into this form of instruction,"" says Jelena Kleut, a professor at the Faculty of Philosophy at the University of Novi Sad.

""The only fair response is to reject such teaching, and some colleagues have done just that — regardless of the consequences,"" she told DW.

Students bear the brunt

But the heaviest burden is borne by the students themselves. Many are refusing to go along with such forms of tuition, even though the end of the academic year is approaching and no one knows what will happen next.

The students have warned that if snap elections are not called, citizens could take 'all available measures of civil disobedience to protect their basic right to a free and legitimate democratic system' Image: Maxim Konankov/NurPhoto/picture alliance

""If the state begins retaliating against students, we could end up with entire classes repeating the year and losing their student status. I don't think that will happen — the scale would be enormous — but we've seen the government do things we once thought impossible,"" says Kleut.

High school seniors face even greater uncertainty: Instead of preparing for university entrance exams, they are waiting to see what the state will do. The government has yet to authorize universities to enroll new students.

Kleut finds it unacceptable that these students are being used as pawns in the standoff between the government and academia.

""But they have been a very rebellious part of society, too. They blocked their high schools . Perhaps the government simply doesn't like the idea of a whole new rebellious generation appearing on university campuses,"" Kleut adds.

Targeting student allies

Repression in Serbia is spreading — not only targeting protesters, but also anyone who has supported them over the past eight months.

Three teachers at Svetozar Miletic High School in the small town of Srbobran were fired for suspending classes in solidarity with the students. One of them was Slavica Fil"
Will Serbia stick with Europe? Playing East against West is in its DNA - UnHerd,https://news.google.com/rss/articles/CBMiaEFVX3lxTE1KTjNZb2VCbXBrRlA4WUc5RkdmOG1uczJvU2kxSEZkM3pkR2Y3UnBMVm5nV2xIYTREZUJKdkV1ZENvN0xUbDBBUHoyTHhRaXFiS0YtcUxDcDlDZWlCeWNQdjRfZHBBNktH?oc=5,UnHerd,2025-08-22,https://unherd.com/2025/08/will-serbia-stick-with-europe/,"The morning after the night before, Belgrade is serene. The roads have been fastidiously cleared of banners and debris. The violence exists now only on social media, and in the collective consciousness. And all the while the government does its best to ignore the chaos — but the people refuse to forget.

Serbia’s protests began back in November 2024, after the concrete canopy of the Novi Sad train station collapsed, killing 16 people. The people were quick to blame the disaster on government corruption and incompetence. The station’s canopy, after all, had recently been renovated by Chinese engineers. And though the authorities insist the project was “up to European standards”, no one believes that, especially when the relevant documents remain classified.

Yet if Novi Sad was the trigger, the longevity of Serbia’s protests imply a deeper and broader malaise. Over the last nine months, they’ve morphed from anger over a single issue to a general movement for change, one encompassing the country’s very civic identity. At the centre of it all is President Aleksandar Vučić, who over the last decade has morphed from a far-Right nationalist to a supposedly pragmatic pro-EU figure. Along the way, he has come to epitomise two things: both the long-standing ambiguity of Serbia’s geopolitical position, and a broader continent-wide slide towards populist autocracy.

In a sense, Vučić’s very person is ambiguous. A man of relentless will and fertile intelligence, he is also famed for his oddly feminine lips (one of his nicknames is “pussy lips”). He has been in power for 12 years, circumventing the constitutional term limit by “doing a Putin” and switching between being president and prime minister. Those on the streets have had enough — and many blame Vučić personally. “He’s been in power for so long now, that for many of the protestors that is like a half of their lives,” says Marija, a young professional who has attended several protests.

Among other things, Marija accuses Vučić of hollowing out state institutions, instead framing national life around his Serbian Progressive Party (SNS). Just as bad, she adds, is the fallout of the Novi Sad disaster. Apart from those still-unclassified files, she notes that only Serbs have yet been charged for the collapse. “It’s final proof for many not just of the cost of corruption but also the protection of foreign investors.” Other young demonstrators have similar complaints. “We want early elections, the reintroduction of democratic norms, an end of mass corruption,” says Stefan, an IT consultant. “We just want the chance to improve our lives.” Fair enough: with inflation around 5%, the cost of food and utilities rising, life here is getting tougher.

All this helps explain why, close to a year on, the protests are still going strong. As I walked through central Belgrade over the weekend, it was impossible to avoid the anti-government chatter after yet another demonstration. If, however, the anti-Vučić crowds are resolute, so is the government. For eight months, things remained largely peaceful. But then, in June, police arrested hundreds of demonstrators, spurring their comrades to blockade roads. That, in turn, prompted the government to flood the streets with counter-demonstrators. Now, both sides are doubling down. Last week, anti-government protesters set the offices of the SNS on fire during a fifth consecutive night of protests.

The police responded with now-customary brutality in Belgrade and Novi Sad. In the city of Valjevo, they used stun grenades and tear gas on protestors. Dozens have since been injured in clashes, with hundreds more detained. According to one young activist named Milos, by now a veteran protester and talking to UnHerd using a pseudonym, the police are “brutal”, adding that they protect gangs of paid thugs to attack demonstrators. For his part, Vučić has said, with the type of prophylactic language beloved by dictators, that the government will not “remain unresponsive”.

It is, though, under pressure. SNS support has steadily eroded. According to a July poll, 54.8% now support the “student list” — an anti-government coalition, as the name suggests partly composed of the middle classes — compared to the 42.1% sticking to Vučić. But in the rural areas, and among the elderly, government support remains huge. The country is polarised, even as some retired people are now coming out in support of the students, joined by less-educated Serbs tired of seeing their living standards drop. The President’s term ends in 2027, and he’s promised to step down then, hoping to mollify the public. But no one buys this; he’s said it too many times before.

All the while, the protests have brought out an increasingly autocratic strain in the President — and not just on the streets. The government now regularly accuses NGOs of plotting to destabilise the country with foreign funding. Serbian media is also less than free. Several pro-Vučić advertising agencies flood TV "
What's Behind The Eruption Of Violence At Protests In Serbia? - Radio Free Europe/Radio Liberty,https://news.google.com/rss/articles/CBMib0FVX3lxTFA5dXlFNDNjOEhLUGZsdGJ6eDJKdXgtTWp5Z0FIR2cwVEtSWmRFNDVPb0ZXX2ZtVEVHaDl0MDF1eTVMTFFfbEt4LU1zbFN6SzdNYjVGUFNoMm9iX3hUaTZHMEJqQkZqTmU5MmFRVWhkRdIBckFVX3lxTE5SSzNySVI4M0NhRXZNb3dwenRnaVdBSEdHamRWQjVZMFAxN1Q0UVJhOEotOVk1Y0h5dWRrLVF4TW5DZDBJclktTm9NYUt6a3lFX1FJVDVqdUk0S0x4U0dVWndNeWotNHMyQTRGZC1HOVlpZw?oc=5,Radio Free Europe/Radio Liberty,2025-08-20,https://www.rferl.org/a/serbia-protests-violence/33507346.html,"A wave of protests that began in Serbia in November 2024 has entered a new phase, with demonstrators and police clashing daily since August 12, when violence broke out in the northern cities of Vrbas and Backa Palanka.

Those incidents sparked protests in dozens of Serbian cities, including the capital, Belgrade, as accusations of police brutality spread across the country.

""Four or five of them (policemen) beat me, pushed my head into a concrete [surface],"" physics student Dusan Cvetkovic told RFE/RL's Balkan Service. Cvetkovic was arrested in Belgrade on August 14 during an anti-government protest.

The Serbian Interior Ministry has neither denied nor commented on Cvetkovic's claims, or those of other protesters who accused police of using excessive force.

The protests have been further fueled by a video that appeared on the second day of clashes showing young men detained in Novi Sad kneeling before police officers after being arrested.

The images were initially published by pro-government media. Cvetkovic also said he was taken in an unmarked car to a garage and left with bruises on his face after a beating he received there.

In other incidents, supporters of the ruling Serbian Progressive Party (SNS) attacked peaceful demonstrators.

Who Is Behind The Demonstrations?

Calls for demonstrations have circulated daily on social media. People are invited to join through social media groups that students have been using to communicate with the public since the beginning of the protests.

Many citizens have responded peacefully, but footage by RFE/RL and other media has also shown masked men throwing stones and pyrotechnics at the police.

Protesters trashed several SNS offices and in Valjevo, 80 kilometers southwest of Belgrade, also damaged the headquarters of the Serbian Radical Party, led by convicted war criminal and Serbian President Aleksandar Vucic's former mentor, Vojislav Seselj.

The spark for the initial protests in November 2024 was the deadly collapse of a railway station roof in Novi Sad.

The tragedy killed 16 people and shocked the public amid reports that corrupt practices led to shoddy construction at the railway station, a flagship government project led by Chinese businesses.

In the following days, dozens of faculties in Belgrade, Novi Sad, Nis, and other university cities were blocked by protesting students supported by the majority of professors.

These developments sparked a wave of demonstrations not seen since the overthrow of Slobodan Milosevic’s regime in 2000.

Initially, demands focused on accountability for the Novi Sad tragedy and sought the prosecution of those who attacked student demonstrators. Six months later, student organizations, until then largely apolitical, called for snap elections.

What Was Vucic's Response?

Some of the students' demands were met. The government released thousands of documents related to the Novi Sad reconstruction. But critics argue the archive was incomplete and failed to clarify key details.

They also said that by delivering thousands of documents Vucic and the government were merely trying to appear transparent while in fact deepening confusion about the station project.

In July, the SNS dismissed four party activists accused of attacking Belgrade drama students at peaceful protests in January.

Vucic, however, has never condemned inflammatory rhetoric from his party's officials or pro-government media, some of which has compared demonstrators to Nazis or Croatian World War II-era fascists, the Ustashe.

What Will Happen Next?

The future of the protests and the overall political situation in Serbia remains uncertain.

The divide between Serbia's ruling elite and its critics is wider than ever. Public anger at corruption and organized crime, highlighted in EU progress reports year after year, has reached unprecedented levels.

For the first time since his party came to power in 2012, Vucic faces genuine social resistance. Yet this resistance is not politically articulated because there is no dominant party among the opposition.

The only unifying force behind the rebellion is the student movement -- a generation of young people who have already lost a year of their studies to protests."
Rival protester groups clash anew in Serbia amid escalating political crisis - France 24,https://news.google.com/rss/articles/CBMivAFBVV95cUxPZkJFRXZoeW52Ty01aGEyZWNGUlpJUmR0YURJQ3JmVTZGWFJ0dzNOZkR1SFlDa1ZvMmNVSGNXSl9abzVOenQtdkRMSjVYX0NSanZIcllaSnRrQW9Cb1N1eGd1cEtIYVZ1T3laR1A0SVNKcUlHYTAxTG8yeWQxQ19WbGZSelk2LWJMaWpINUVIQUFhYTVOSEE0eXZqVmVnZ09rLThGYWE4aHRZZFhEWVh1Y0ZRQ040S3VPeVIzVQ?oc=5,France 24,2025-08-15,https://www.france24.com/en/europe/20250815-rival-protester-groups-clash-anew-in-serbia-amid-escalating-political-crisis,"A person fires fireworks, during a standoff between supporters of the ruling party and anti-government protesters in Belgrade, Serbia, August 14, 2025.

Clashes between rival groups of protesters in Serbia flared again late Thursday, police said, as months of anti-government demonstrations boiled over into street violence this week.

A wave of anti-corruption protests has gripped Serbia since November, when the collapse of the Novi Sad railway station roof killed 16 people, a disaster widely blamed on entrenched corruption.

Anti-graft protesters again gathered in several cities across Serbia late Thursday.

That was mainly in response to a previous attack by governing party supporters on demonstrators Tuesday in the town of Vrbas, about 160 kilometres (100 miles) north of the capital Belgrade.

Read moreSerbian riot police fire tear gas at anti-government protesters demanding snap elections

Large groups of pro-government supporters, most wearing masks, confronted protesters on Wednesday, and the two groups hurled bottles, stones and fireworks at each other.

Police had arrested nearly 50 people across the country on Wednesday, and around 30 riot police were injured.

On Thursday, protesters vandalised the Novi Sad headquarters of the ruling Serbian Progressive Party (SNS) and two other SNS offices in the city, RTS television reported, during protests spread across Serbia.

In the capital Belgrade, protestors massed in front of government buildings and the army headquarters, before heading toward nearby SNS offices.

But a heavy riot police deployment kept them from reaching the offices using teargas.

""These are no longer peaceful student protests but people who want to provoke violence... This is an attack on the state,"" Interior Minister Ivica Dacic told a news conference.

At least five police officers were injured on Thursday evening and 14 protesters were arrested, the ministry said.

'Intensifying crackdown'

Frustrated with government inaction, protesters have demanded an investigation into the Novi Sad tragedy and piled pressure on right-wing President Aleksandar Vucic to call early elections.

Over the past nine months, thousands of mostly peaceful, student-led demonstrations have been held, some attracting hundreds of thousands.

But this week's violence marks a significant escalation and indicates the increasing strain on Vucic's populist government, in power for 13 years.

Read moreWhy has the EU kept silent on Serbia’s massive protest movement?

Since June 28, when around 140,000 demonstrators gathered in Belgrade, the government has responded with an ""intensifying crackdown"" on activists, according to a statement by UN human rights experts released earlier this month.

Protesters and those linked to the movement have faced a ""troubling pattern of repression"" including excessive police force, intimidation and arbitrary arrest, the experts said.

Vucic has remained defiant, repeatedly rejecting calls for early elections and denouncing the demonstrations as part of a foreign plot to overthrow him.

Student protesters have accused the police of protecting pro-government supporters while doing little to stop the attacks on their own gatherings.

""The authorities tried to provoke a civil war last night,"" the students wrote on their official Instagram page.

Vucic, who had visited pro-government encampments overnight Wednesday, denied his supporters had started the violence.

""No one attacked them anywhere,"" he said of the anti-government protesters, speaking at a late-night press conference.

""They went everywhere to attack those who think differently,"" he added.

While the protests have so far led to the resignation of the prime minister and the collapse of his cabinet, Vucic remains at the helm of a reshuffled government.

(FRANCE 24 with AFP)"
Protesters in Serbia's north demolish ruling party offices - Reuters,https://news.google.com/rss/articles/CBMinAFBVV95cUxQOXY0VDNCOEVLczNhRnV1MW41dENWRlFRT3dwdjY0cGp1bHJ4LWNrRDFiWEFXUkhXYmtST0dMSmYxZWNtYURWdkZubHVnekQxZVlrRVNnZDVjZTFTR0VhdjdiS250TG5fY1IyNVoyOHhGOGRkT0dEaHZITkFIWWNFT0tQZVJRT3N2d0dpejAwN3NrczJQYlpzVFFnaDM?oc=5,Reuters,2025-08-14,https://www.reuters.com/world/protesters-serbias-north-demolish-ruling-party-offices-2025-08-14/,"BELGRADE, Aug 14 (Reuters) - Anti-government protesters demolished the offices of the ruling Serbian Progressive Party (SNS) in the northern city of Novi Sad and clashed with police and SNS supporters in the capital Belgrade on Thursday, a day after violent unrest left dozens injured.
In Novi Sad, Serbia's second-largest city, police and SNS supporters loyal to populist President Aleksandar Vucic were absent as dozens of anti-government protesters smashed the windows of the party's offices, threw out furniture and SNS paraphernalia, and splashed paint across the entrance.
The Reuters Daily Briefing newsletter provides all the news you need to start your day. Sign up here.
Advertisement · Scroll to continue

AD

Report This Ad
""He's gone,"" protesters chanted in unison, referring to Vucic's 13-year-long rule.
Police in full riot gear later cordoned off several blocks in Novi Sad's city centre and used tear gas to disperse the crowd.
Daily protests across Serbia, sparked by the deaths of 16 people when the roof of a renovated railway station in Novi Sad collapsed last November, have rattled the popularity of Vucic and the SNS.
In Belgrade, hundreds of protesters and SNS supporters threw flares and firecrackers at each other on one of the city's main boulevards.
Police in full riot gear charged the anti-government protesters and used tear gas to force them to leave the area, a Reuters witness said.
Advertisement · Scroll to continue

AD
Interior Minister Ivica Dacic accused protesters of attacking police in Novi Sad and Belgrade, and towns of Pancevo and Sabac. At least five police officers were injured, he said.
""Police had to act ... to avert attacks,"" he told a news conference in Belgrade. ""We are urging everyone to leave the streets.""

Item 1 of 5 Fireworks explode, during a standoff between supporters of the ruling party and anti-government protesters in Belgrade, Serbia, August 14, 2025. REUTERS/Djordje Kojadinovic
[1/5]Fireworks explode, during a standoff between supporters of the ruling party and anti-government protesters in Belgrade, Serbia, August 14, 2025. REUTERS/Djordje Kojadinovic Purchase Licensing Rights, opens new tab


In a live broadcast, the Belgrade-based N1 TV showed at least five protesters being detained by police.
Vucic pledged more arrests after the protests.
""I think it is clear they did not want peace and Ghandian protests. There will be more arrests,"" he said in a live broadcast by Belgrade-based private Informer TV.
The opposition Party of Freedom and Justice said that Pedja Mitrovic, its parliamentary deputy, was injured during the protests and hospitalised.
""This is the handwriting of this government and Aleksandar Vucic, this is how they see Serbia,"" the party said in a statement.
Similar protests were held in towns across the country.
Earlier on Thursday, Dacic said that 27 police officers and around 80 civilians were injured in Wednesday’s clashes, and 47 people had been detained.
Protesters have blamed corruption for the Novi Sad railway station disaster and are demanding early elections in hopes of ousting Vucic and his party.
Students, opposition groups, and anti-corruption watchdogs have accused Vucic and his allies of ties to organized crime, using violence against political rivals, and suppressing media freedoms—allegations they deny.
Reporting by Fedja Grulovic and Aleksandar Vasovic; Editing by Alistair Bell"
