title,url,source_name,date_found,actual_url,text
EU calls for restraint amid violent protests in Serbia - MSN,https://news.google.com/rss/articles/CBMipgFBVV95cUxPbk9nZzlfS29uVjU4V1Z3WFdWU1pfVF9uQ0VMYzNmMGdaYV9VTUI0eTk1a2poVkNmX2tpZnlHWHROTzd5N0tNRUo1aXR4TjFNck5BUHN0LU5KQTJNZmNvT2ExNWotVy03R0tsLUZfX0FISVdBckpBRGF5Z3ExZFJzUHR2aWpjTnlwdDRZdnIxMVdLUTVaSWdBM3Ytb2VQSjljVWdvTkpn?oc=5,MSN,2025-08-21,https://www.msn.com/en-us/news/world/eu-calls-for-restraint-amid-violent-protests-in-serbia/ar-AA1KRwsA,"The European Union has called for restraint and respect for fundamental rights in Serbia, as anti-government protests that have continued for nine months escalated into violence in recent days.

EU ambassador to Serbia Andreas von Beckerath met with Serbian National Assembly president Ana Brnabic on August 19 to discuss the deteriorating political climate, electoral and media reforms and recent unrest.

Are you ready to take a break?
Ad
Are you ready to take a break?
Heroes of History
call to action icon
“The EU underlined the need by all parties to uphold the respect for fundamental rights, including the right to peaceful assembly,” the EU Delegation to Serbia said in a statement after the meeting. The ambassador condemned all acts of violence and hate, and urged political actors to avoid inflammatory rhetoric and the spread of disinformation.

Violent clashes between protesters, riot police and pro-government supporters have escalated over the past week. President Aleksandar Vucic and his ruling Serbian Progressive Party (SNS) have faced criticism for allegedly enabling unrest through tacit support for pro-regime violence and disproportionate policing.

Von Beckerath emphasised that any suspicion of excessive use of force must be properly investigated. He also highlighted the importance of protecting journalists and ensuring that police actions remain proportionate and in line with human rights standards.

Award-winning flights…
Ad
Award-winning flights…
Jet2.com
call to action icon
Dialogue across the political spectrum remains “the only way forward,” the ambassador said, urging all sides to de-escalate tensions and pursue reforms through democratic channels.

Brnabic, for her part, briefed the EU official on Serbia’s progress in the areas of rule of law and European integration. She said that moving forward with EU accession talks — including opening Cluster 3 of negotiations — was a key priority.

In her remarks, Brnabic said the country had seen “daily attacks against police and public institutions, courts and prosecutor’s offices, torching of party offices — primarily those of SNS but also of other parties — destruction of property, and intimidation of journalists and family members of government officials”.

“These actions are a direct assault on the constitutional order, media freedom, and basic citizen security,” she said. “They cannot be reduced to political disagreement or peaceful protest.”

Halloween Special: 10% Off Professional Motion Simulators for Your Home! Why settle for...
Ad
Halloween Special: 10% Off Professional Motion Simulators for Your Home! Why settle for...
DOF Reality Corp
call to action icon
She called on the international community to deliver a “decisive and unambiguous response” to the violence.

The EU has repeatedly stated that Serbia’s accession path depends on meaningful reforms in rule of law, media freedom and democratic governance. Von Beckerath welcomed the recent efforts to reform electoral laws and the selection of the REM media oversight council, while stressing that all processes must be inclusive and transparent."
Roadblocks replace rallies as Serbian protesters demand new elections - BBC,https://news.google.com/rss/articles/CBMiWkFVX3lxTE80NEhMWHpqU0tzUFZ4TTdPRFJYdlh0UTRoTHEwcW9WTHhfYUFORVFHZXdaN0M4SEp3WE42VjRhTGR4S2hVay02MjhpVTBSamdHQU9iRTM2NW1EQdIBX0FVX3lxTFBBWkNSYkhlTWd5S0Ixc2JrMW00WVQwZzZ2SFdvdWs4V1d4SXZtX2FobS1GdEQ4VHZ1U1R3NHFvZHBkWTJlRFZyUW1lUDFob25uVHpCZldLbFplWVBQYUxj?oc=5,BBC,2025-07-03,https://www.bbc.com/news/articles/cvg4r3ny9q2o,"Roadblocks replace rallies as Serbian protesters demand new elections

4 July 2025 Share Save Guy De Launey BBC Balkans correspondent Share Save

Getty Images

As Serbia's anti-corruption protests enter their ninth month, they show no sign of abating – and are instead changing in their leadership, composition and tactics. At the climax of last weekend's 140,000-strong protest in Belgrade's Slavija Square the students who led the protests since November declared that they would no longer spearhead the rallies. They had set a deadline of Saturday for the government to call for fresh elections. When that was not met, they invited other groups to take on the protest mantle - and called for a campaign of ""civil disobedience"" from anyone opposed to the leadership of President Aleksandar Vucic and his long-governing Progressive Party (SNS). Since then roadblocks have been popping up in cities across Serbia this week and people have been deploying dustbins, chairs and other improvised barriers to block junctions in major cities including Belgrade, Novi Sad and Nis. Local residents' associations - known as ""citizens' assemblies"" - have been heavily involved. As soon as the police dismantle one blockade, another one pops up somewhere else.

Police crackdown triggers backlash

In recent days there have been dozens of arrests – along with complaints of excessive police force. A number of students were treated in hospital – one with a broken collarbone – after Gendarmerie members entered Belgrade University's Law Faculty on Wednesday. Officers also arrested high school students, triggering a protest by parents in front of a central Belgrade police station until their children were released. A striking range of voices have condemned the police conduct. Complaints by the journalists' association and the opposition Centre Party were matched by statements from the Bar Association and even Serbian Orthodox Church Archbishop Grigorije Duric. The EU, for its part, decried the ""acts of hatred and violence"" and called for calm. Meanwhile, in Belgrade, the pop-up roadblocks continue – and so does the ensuing travel chaos for commuters. One resident, while ruefully noting that she had to walk 5km (3 miles) to and from work, described the mood as more like a series of street parties than a protest. But many observers doubt whether this approach will be any more effective than the months of rallies, faculty blockades and half-hearted general strikes.

The 2024 Novi Sad railway disaster

The protest movement started with a relatively simple purpose: to ensure accountability for last November's disaster at Novi Sad railway station, when a concrete canopy at the recently renovated facility in Serbia's second city collapsed, killing 16 people who were standing beneath it. The outpouring of grief was instant – and the outrage swiftly followed. Much of it has been directed at President Vucic. A large section of Serbians have long been uneasy with his ""strongman"" style of leadership, since he came to power in 2012. But others have accepted his party's firm grip on state institutions and much of the media as a trade-off for strong economic growth and improvements in infrastructure. Fury over Serbia station tragedy prompts first arrests

Serbia's largest-ever rally sees 325,000 protest against government The station disaster shattered that tacit agreement. ""We are all under the canopy"" was one slogan frequently seen on banners in the early days of the protests. Others included ""blood on your hands"" and ""corruption kills"". University students took leadership of the movement, demanding full transparency about the railway station project and the prosecution of those responsible for the disaster. Months of protests eventually forced the resignation of Milos Vucevic as prime minister. But he was simply replaced by another Vucic appointee, Djuro Macut – and the protest movement has otherwise achieved little in terms of concrete results.

Getty Images A smashed window of the Serbian Progressive Party (SNS) office in Novi Sad during this week's protests

No end in sight for protest movement"
Serbia: Attacks on journalists reach unprecedented levels amidst ongoing anti-government protests - ipi.media,https://news.google.com/rss/articles/CBMitgFBVV95cUxPdXpuOWU2d0lqODUySmtFa0F4MGJDblJHYURzS3JKc3daWlh1WlpFN0N0ajhJWjB3dnhCS1hlVmt3TW5UdXRWNVhLeGdtdlZ0dWxTbXBvZjlnRG1DODdLVjk2dzlrRm1CV0ZaR3JkanhjRnJqVFU0WGNnSGpZRHV3SUxHRWxmY2MwNzViWEZWQzVRaTJzdDZjNlBYVlV6ZVVseEpQR0N6UVFETUVDWTVNbEZiUVNmUQ?oc=5,ipi.media,2025-08-22,https://ipi.media/serbia-attacks-on-journalists-reach-unprecedented-levels-amidst-ongoing-anti-government-protests/,"By IPI contributor Jelena L. Petković

This article is part of a series published by IPI and written by expert guest contributors from across Europe on different threats facing media freedom and independent journalism. This article focuses on the latest surge in attacks on journalists in Serbia in the last week amidst the latest anti-government protests and the state response. The views of the author do not necessarily reflect those of IPI.

Amidst the increasingly violent state response to anti-government protests in Serbia recent days, attacks and pressure on journalists have reached unprecedented levels, deepening what is already one of the worst media freedom crises in Europe.

Death threats and physical attacks against journalists and media workers are now occurring on a near daily basis, as reporters and photojournalists cover violent clashes between riot police, government-backed hooligans and student-led protesters.

Yet even as the law enforcement authorities and the Serbian Progressive Party (SNS) led government of President Aleksandar Vučić crack down and the emergency situation for journalists worsens, many in Serbia have the feeling that worse is yet to come.

The Independent Association of Journalists of Serbia (NUNS) told IPI it has now recorded more than 232 different attacks between the beginning of the year and August 22.

More than 42 attacks against journalists were recorded since the first day of August, with 10 occurring during coverage of recent mass protests on August 13, when the latest surge of protests broke out across the country carrying calls for new elections.

“The number includes 52 cases from March until now of assaults, threats, obstruction by the police or when the police did not respond – when the law enforcement officers witness the attacks, they simply turn and walk away,” Rade Đurić, a lawyer at NUNS, told IPI. “We haven’t yet counted hate speech and other forms of pressure. Who knows how many stayed under the radar.”

This high number of attacks on journalists – the most ever recorded in modern Serbia during that time period – and the lack of accountability for the perpetrators, is having a chilling effect on the press as they try to cover the ongoing protests.

Yet even as the tactics of the government and police become increasingly apparent, independent media and civil society in Serbia are again criticising reactions from Europe as lukewarm and insufficient.

“For us, in an authoritarian society, the most dramatic thing is that despite dozens of attacks on journalists a day and many more on citizens, the EU does not respond in a meaningful way,” Veran Matić, chairperson of the management board of the Association of Independent Electronic Media (ANEM), told IPI.

He added: “The citizens of Serbia have been expecting a proper reaction from the European Union for months. There is no adequate response from the EU institutions, which emboldens the government. Every day we have a dozen new attacks on journalists, and this is the new normal.”

Covering the protest movement

Student-led protests began nine months ago after the collapse of a canopy at the renovated railway station in Novi Sad, killing 16 people. Initial demands for the full disclosure of information and accountability for the tragedy became aimed at wider negligence and calls for an end to state corruption.

As the demonstrations morphed into a wider citizen movement and the largest anti-government protests in modern Serbia, professional journalists and media organisations reporting on them were increasingly targeted by government supporters and politicians, who branded them as “foreign mercenaries”, “terrorists” and “anti-Serbs”.

As well as pro-government media and commentators, these verbal denigrations and smears have been increasingly taken up and echoed by SNS politicians and even from the executive, with Vučić himself dangerously branding media organisations N1 and Nova “terrorists” and liars attempting to overthrow his government.

As protests swelled again in Belgrade and cities across the country in recent days, Serbian police have faced condemnation for the use of disproportionate force against civilians and for the tacit permittance of attacks on protesters by government-backed hooligan groups, which has led to violent clashes and numerous injuries. Photojournalists documenting police brutality are often the first in line for these attacks and make a bulk of those injured.

As well as attacks from SNS supporters and hooligans, there have also been numerous allegations and in some cases documented examples of media workers being violently attacked by police while covering the clashes, despite wearing clear PRESS insignia, prompting journalists’ and media organisations in Serbia to warn that a red line has been crossed.

Recent police violence against the press

On August 13, Kompas journalist Danica Ilić was attacked while filming President Vučić addressing his supporters in front of party premi"
Serbs plan fresh protests as anti-gov't unrest grows - Central European Times,https://news.google.com/rss/articles/CBMijgFBVV95cUxQcVVkbF8wLXdWR3hqSk1PLUVWc0VHbC1pZmdjbDM5Q1g0RWVjWllaeHNrOUUxTmdVWUZmejZva1paQ2NXOF9JanJlaklqYzU1dW1kTUNpbjlOTVBEOWJmU3lBVUtNcnYyX1FmOHQzMjdUWGFzU3pJc2ZnLTJDeWx0a0xEbmxsY2U5eDA0aVZB?oc=5,Central European Times,2025-06-30,https://centraleuropeantimes.com/serbs-plan-fresh-protests-as-anti-govt-unrest-grows/,"University students in Serbia will lead another round of anti-government protests in the capital city of Belgrade this week, deepening a political crisis that has exposed widening rifts in the country’s institutions and democratic trajectory.

The demonstrations follow street blockades, dozens of arrests, and growing public opposition to the ruling Serbian Progressive Party (SNS), accused by protesters of authoritarian overreach and institutional capture.

Demonstrations intensified over the weekend as student-led groups erected makeshift barricades at key intersections in central Belgrade, including Kneza Milosa, Nemanjina and the Gazela Bridge. Police estimated Saturday’s protest turnout at 36,000, while independent observers cited figures as high as 140,000.

Clashes were reported in several locations. Riot police used batons, shields and pepper spray to disperse crowds. According to official figures, 48 police officers were injured, while 22 protesters required medical attention.

Street barricades cleared

Police moved in early on 30 June to dismantle the barricades. The Interior Ministry reported 77 arrests during the operation, with 38 individuals facing criminal charges. Further detentions were reported on 1 July, bringing the total arrests over the weekend to more than 110.

Video footage showed protesters throwing stones and flares at security forces, while several journalists were pushed or obstructed during live reporting near Slavija Square. Rights groups have called for an independent inquiry into the use of force.

“We will not allow foreign-instigated destabilisation,” Gasic said in a televised statement. “Serbia is a lawful state, and protests must remain within legal limits.”

The Belgrade Centre for Human Rights condemned the security response, calling it excessive. Several journalists and bystanders reported being pushed or threatened during the police operation.

Flashpoints multiply

Public anger has grown over the appointment of Bratislav Zivkovic, a former paramilitary commander, to the board of Serbia’s National Theatre. Critics say the move reflects a broader state effort to legitimise figures linked to wartime violence.

Protesters have also pointed to ongoing pressure on independent media and the judiciary, as well as what they call the politicisation of public institutions under Serbian President Aleksandar Vucic.

Opposition parties have expressed support for the protests but student leaders insist their movement remains unaffiliated. “This is not just about one party,” protest spokesperson Milica Vukovic said on 30 June. “It’s about our right to live in a country where institutions serve citizens, not political strongmen.”

Muted EU reaction

The European Commission (EC) has reiterated its support for Serbia’s EU accession path but has not commented on the recent unrest. Several MEPs have raised concerns over media freedom and the rule of law. In a European Parliament debate on 25 June, MEP Viola von Cramon said, “Serbia continues to regress on key democratic indicators while pretending to align with EU values.”

Protesters plan weekly gatherings

The protest wave was sparked by the 1 November 2024 collapse of a newly built concrete canopy at the railway station in Novi Sad, northern Serbia, which killed 16 people and injured dozens.

The disaster, blamed on substandard construction and opaque public contracts, became a national scandal and a symbol of what protesters describe as systemic corruption and impunity under the SNS. Initial vigils in Novi Sad quickly spread to Belgrade and other cities, evolving into a broader student-led movement demanding accountability, transparency and institutional reform.

Timeline of Serbia's Protest Movement since the Novi Sad Disaster/ Source: CET

The next protest, scheduled for 1 July, will begin at the University of Belgrade and proceed toward the National Assembly. Student organisers are demanding snap elections, the dismissal of Interior Minister Bratislav Gasic, and a reversal of recent controversial public appointments.

Organisers plan to march every week until their demands are addressed. A night vigil is scheduled for 2 July outside the National Theatre. “We are not afraid,” said a statement from Students for Democracy. “We will not look away.”

The protests in Belgrade mirror recent student-led unrest in Slovakia, Georgia and Bulgaria, where democratic backsliding and corruption have become central issues."
Thousands back on streets in Serbia as anti-govt protests escalate | Daily Sabah - Daily Sabah,https://news.google.com/rss/articles/CBMiqgFBVV95cUxNZGRIcllWRUtYZU1JNm1lWjVJTVF1S0N1VGdCUDZZRGJ3R0F0Z0RYal9WeHhQZGJHeTR6T3lodEhOTVlwbWJGYk5DM3A2VEdLdW5YeTBVN08zOVVoR3VrQTk2QmZ2SzluZnZlOC1SRV9oaE5BS1BOZVRjV0VlOG9zVUx4a094M0trcWEwTzhYUndOX013d2hLRWptTFM1SkF6MkU5WkZOMnBiQdIBrwFBVV95cUxQMGtSak8tOFh5d0I2UGF0QXZCNTJpZFFXbTlpdHdqOWZQVUNXSWhMalpDcUVLeTBsWDNNV3J6TDNaUmVjMlM2NmZzLWZmdDNWbjVVMHpJSjlMc2Qwd3dmeXdfU2pWcmEtazBEZExMVWhZTXo0bVhHbmZ6NXlvNlhuV3BEd0owVEFvS1M4SUNSSnNmcDl2UGNDOURIdzBGRmhzMXI2YmtoaWRuVjFRc1A4?oc=5,Daily Sabah,2025-08-14,https://www.dailysabah.com/world/europe/thousands-back-on-streets-in-serbia-as-anti-govt-protests-escalate,"Thousands of anti-government demonstrators returned to the streets in Serbia on Thursday, following two days of violent clashes with supporters of President Aleksandar Vucic and riot police that left dozens injured or detained.

Police fired tear gas in the country's capital and several other incidents were reported elsewhere.

In the northern city of Novi Sad, where the anti-Vucic revolt in Serbia started more than nine months ago, groups of young protesters shouted, ""He is finished,"" as they demolished the offices of the president's ruling Serbian Progressive Party (SNS).

The demonstrators broke windows on the party's downtown office and carried away some documents and pieces of furniture from inside. The police or Vucic's supporters, who have guarded the office for months, were nowhere to be seen.

Members of the Serbian Gendarmerie face protesters during anti-government protests in Belgrade, Serbia, Aug. 14, 2025. (EPA Photo)

In Belgrade, the Serbian capital, police in the evening fired tear gas in at least two locations to disperse the protesters and keep groups of supporters of the opposing camps apart. Protesters in a downtown area scrambled in panic, some tumbling to the ground as they tried to run away.

Vucic told pro-government Informer television that ""the state will win"" as he announced a crackdown on anti-government protesters, accusing them of inciting violence and of being ""enemies of their own country.""

He reiterated earlier claims that the protests have been organized from abroad, offering no evidence.

The unrest throughout Serbia this week marked a serious escalation in largely peaceful demonstrations led by Serbia's university students that have shaken Vucic's firm grip on power in the Balkan country.

Rival groups on Wednesday hurled rocks and bottles at each other amid clouds of smoke and chaos. An army security officer at the SNS party offices at one point fired his gun in the air, saying later he felt his life had been in danger.

A Serbian police officer detains a person during anti-government protests in Belgrade, Serbia, Aug. 14, 2025. (Reuters Photo)

Interior Minister Ivica Dacic on Thursday said there were gatherings at some 90 locations in the country the previous evening.

The Serbian president has faced accusations of stifling democratic freedoms and of allowing organized crime and corruption to flourish in the country, which is a candidate for European Union membership. He denies those allegations.

The EU's Commissioner for Enlargement Marta Kos said the reports of violence were ""deeply concerning.""

""Advancing on the EU path requires citizens can express their views freely and journalists can report without intimidation or attacks,"" Kos added on the social media platform X.

Serbian police officers face protesters during anti-government demonstrations in Belgrade, Serbia, Aug. 14, 2025.

Protesters gathered in large numbers again on Thursday evening in Belgrade, Novi Sad and in some smaller towns, defying sharp warnings against protests from Vucic and other government officials.

On Wednesday evening in the capital, riot police used tear gas to disperse groups of protesters. Police officers formed a cordon around a makeshift camp of Vucic's loyalists outside the presidency building downtown.

Dacic, the interior minister, accused the protesters of attacking governing party loyalists. He said, ""those who broke the law will be identified and sanctioned.""

University students posted on X to accuse the authorities of trying to ""provoke a civil war with the clashes"" at demonstrations. The rallies so far passed for the most part without incident, even while drawing hundreds of thousands of people.

Occasional violence in the past months mostly involved incidents between protesters and the police, rather than between rival groups.

Serbian police officers wearing civilian clothing detain a person during anti-government protests in Belgrade, Serbia, Aug. 14, 2025. (Reuters Photo)

""Police were guarding the regime loyalists who were throwing rocks and firing flares at the protesters,"" a post by the informal group, Students in Blockade, said. The account is run by students from across Serbia who have been protesting the government since late last year.

Demonstrations started in November after a renovated train station canopy crashed in Novi Sad, killing 16 people and triggering accusations of corruption in state-run infrastructure projects.

The protesters are demanding that Vucic call an early parliamentary election, which he has refused to do. Serbia is formally seeking EU membership, but Vucic has maintained strong ties with Russia and China."
