title,url,source_name,date_found,actual_url,text
Dozens detained as opponents and supporters of Serbian government clash during protests - PBS,https://news.google.com/rss/articles/CBMivwFBVV95cUxQV3R3NDRpb2c3YXZWUWlaV0pSMEdEQTBGOHgwekZOeTRSUXNoNE1rdndJN0RKQTdlNk1teVlmZFcyZ09yTTF6TjdLSWhGRkpXcTBTb3V3RGs5M0RRSTdONENuMWlaRjdxTVV1dWJvb29ITUFLeGhtczRsWkJ0WXRGZThCMVFkcDM0YkJadGh0RUxOcFp5QW1KUmYwVTVTR3czNHF6Q1ExY1RmVWpXeVJ1UGtSaFpLVlFkRWJyeUd2RdIBxAFBVV95cUxPRktDV3Q0Z2ZQWTFnRlZaT3h2cUJVbThva1Zybmo1VG9EeWJmUWwydWsxb1lpV0FQajVKTmlkREJuMnk1QzJNY0xtZFlvYjJremI4ZThJX1FSLU4xUjVwRFpDRmthUDc3eWkycjBFOEJDY1RRLTlUTVhuQUo1NEVObjZIY29jbTRfWUNpdTctUzAyVm11SEdjNGRRbHJRMnZmR3FocndRd0huVlpTaGFpNFVxeVVJcUgtMVVQZ3E4dkpSYkc2?oc=5,PBS,2025-08-14,https://www.pbs.org/newshour/world/dozens-detained-as-opponents-and-supporters-of-serbian-government-clash-during-protests,"BELGRADE, Serbia (AP) — Nearly 50 protesters have been detained across Serbia and dozens of people were injured as violence erupted this week between opponents and supporters of the government following more than nine months of largely peaceful demonstrations against the populist rule of President Aleksandar Vucic, police said on Thursday.

Unrest on Wednesday broke out in the northern city of Novi Sad when supporters of the ruling Serbian Progressive Party threw flares at anti-government protesters who had been marching past the party offices, according to video from the scene. Interior Minister Ivica Dacic said there were gatherings at some 90 locations in the country on Wednesday evening.

At the clashes in Novi Sad, rival groups hurled rock and bottles at each other amid clouds of smoke and chaos. An army security officer at the SNS party offices at one point fired his gun in the air, saying later he felt his life had been in danger.

READ MORE: Clashes erupt at Serbian anti-government protests, with dozens injured

The incidents marked an escalation in protests led by university students that have rattled Vucic’s increasingly autocratic rule in Serbia, a candidate nation for European Union membership.

Similar clashes were also reported on Tuesday evening.

The EU’s Commissioner for Enlargement Marta Kos said on X that reports of violence are “deeply concerning.”

“Advancing on the EU path requires citizens can express their views freely and journalists can report without intimidation or attacks,” Kos added.

The Serbian president has faced accusations of stifling democratic freedoms and of allowing organized crime and corruption to flourish. He denies those allegations.

Skirmishes also erupted in the capital Belgrade where riot police used tear gas to disperse groups of protesters. Riot police formed a cordon around a makeshift camp of Vucic’s loyalists outside the presidency building downtown.

Dacic, the interior minister, accused the protesters of attacking governing party loyalists. He said “those who broke the law will be identified and sanctioned.”

University students posted on X to accuse the authorities of trying to “provoke a civil war with the clashes” at demonstrations. The rallies so far passed for the most part without incident even while drawing hundreds of thousands of people.

Occasional violence in the past months mostly involved incidents between protesters and the police, rather than between rival groups.

“Police were guarding the regime loyalists who were throwing rocks and firing flares at the protesters,” a post by the informal group, Students in Blockade, said. The account is run by students from across Serbia who have been protesting the government since late last year.

Demonstrations started in November after a renovated train station canopy crashed in Novi Sad, killing 16 people and triggering accusations of corruption in state-run infrastructure projects. More protests are planned on Thursday evening.

The protesters are demanding that Vucic call an early parliamentary election, which he has refused to do. Serbia is formally seeking EU membership, but Vucic has maintained strong ties with Russia and China."
"While targeting its critics for foreign funding, Serbian state receives billions from abroad - European Western Balkans",https://news.google.com/rss/articles/CBMi1AFBVV95cUxNVkM5bmpBTk9KenhWYWxianZib05DYTBIWjZTdEY4OEVwREh2VkE2LVVaVDJvQ1k3S0kzTUlzV3duUk9WNXZIOTBUZGR4cC1KT2NQbXBTUGJxX2xDdDQ5bmdBa3Y4MmxvTkxTWGFFcUtUZTd3REFYV190RTBPaHVkYWl0ZzJHeUg5VVdoT0JZT2xRbUVhMGJQdTI2Qlh0cThaeGJBcWZXbVN3eG14Y0RFbTlXUXJsZU9YM1ZCSnQxQVZTYW5aLWdSd2NXSmFrVHNRN2c3MQ?oc=5,European Western Balkans,2025-06-06,https://europeanwesternbalkans.com/2025/06/06/while-targeting-its-critics-for-foreign-funding-serbian-state-receives-billions-from-abroad/,"The highest Serbian officials, along with pro-government tabloids, continue to spread the narrative that the protests in the country are being financed from abroad with the aim of destabilizing Serbia. Old stories about “colour revolution” are being recycled daily in an attempt to divert divert attention from students and citizens demands, who have been protesting for seven months. Meanwhile, the Serbian state and its institutions remain the largest recipients of foreign funding from governments and the EU.

Over the past decade the EU has allocated approximately 64 million euros to support civil society and media – representing only 2-4% of the EU’s total non-refundable assistance to Serbia, which reached over 2.9 billion during the same period.

“The operation to overthrow Serbia has been in the making fro a long time. There has been long-term investment against our judiciary, prosecution… Enormous sums of money have been funelled into Serbian media that have become a platform for destroying Serbia. Billions of euros were invested in bringing Serbia down, and they nearly succeeded”, President of Serbia Aleksandar Vučić said during the SNS rally in Niš.

“Blockaders (the word used by ruling party and tabloids for students) directly linked to London – now everything is clear: Europe is financing the destruction of the state and with those help”, reads one of dozens of articles from the daily tabloid Informer, which routinely targets government critics without consequence.

Informer alleges that foreign governments are financing the protests, claiming that students have met with professor from Faculty of Political Science, Dušan Vučićević, who leads the “Popular Democracy”, project aimed at promoting democratic values among high school students in Serbia. The fact that the project is supported by the Westminster Foundation, publicly disclosed on the project’s website – is used by Informer as “evidence” that British intelligence is behind the protests.

The financing of civil society organizations was also the topic of an Informer morning show featuring former Yugoslav foreign minister Vladislav Jovanović. The show claimed that the West is waging a hybrid war against Serbia and accused independent media outlets and civil society organizations, such as KRIK and Crta, of allegedly hiding their funding sources. It concluded that the prosecution should initiate proceedings against them.

Informer failed to mention that the funding sources of these, and other civil society organizations, are publicly available. Detailed information on projects and donors can be found on their websites.

EU has allocated to civil society and media 2-4 total non-refundable assistance

In their attacks on activists and organizations, pro-government media and officials never mention how much foreign funding the Serbian state itself receives. As the EU Delegation to Serbia stated for European Western Balkans, over the past decade the EU has allocated approximately 64 million euros to support civil society and media – representing only 2-4% of the EU’s total non-refundable assistance to Serbia, which reached over 2.9 billion during the same period.

“The EU provides both financial and technical support to civil society development in Serbia through several instruments, including regional and national grants under the ‘Civil Society and Media’ (CSF) program, as well as the ‘Global Europe for Human Rights and Democracy’ program,” the Delegation stated.

Since 2020, 114 grants have been awarded to 143 civil society organizations in Serbia through three main mechanisms: project (action) grants, operational grants, and financial support to third parties (FSTP).

To support grassroots civic initiatives at the local level, over 700 sub-grants have been awarded to smaller civil society organizations across all 29 districts and 102 out of Serbia’s 174 municipalities.

Civil society organizations in Serbia have addressed a wide range of issues, including media freedom, environmental protection and climate change, youth policy and local youth engagement, human rights, anti-discrimination efforts, democracy, citizen participation in policymaking, social inclusion, Roma issues, healthcare and consumer protection, education and employment, and culture. The Delegation added that since 2020, the European Endowment for Democracy (EED) has awarded 160 sub-grants to 106 media outlets and 54 civil society organizations, with one-third of the initiatives involving youth.

Not only does the Serbian government regularly receive funds from EU member states through European programs, it has also benefited from U.S. assistance in the past.

The United States, primarily through USAID and other agencies, has provided over 1 billion dollars in development aid to Serbia since 2000. The majority of these funds have been directed to the state budget and managed by the ruling political majority through public institutions.

In 2024 alone, Serbia received $40,144,406 fr"
Serbia's police intervene as ruling party supporters face off against anti-government protesters - France 24,https://news.google.com/rss/articles/CBMi1wFBVV95cUxOSVlCUkUzR3JDcVJLNHYyLVlZNDItcy1DcXpQUXVFR1lFbUtZeGpXc2VYbUk0WVZKOUdYQjAyajhWNXEzcnI2UmV2ci13MmlkVjJOaHRBSFVpRkV4MjlCRkxwbDVURkxJUHZFY0NQeGxobE9Dd0tJbm9uLV84SWtWY2pJcFVMWk1qYVhNMV9Na2lwbWZBOGxCV09KbWJ2TkxNa240VGNoblExMXdVQU05cDFUNTZGLUJSX2EwZ3N2eHV3Ylc5anNWNnpfUTRlbG56MXNPTDdQZw?oc=5,France 24,2025-08-14,https://www.france24.com/en/europe/20250814-serbia-s-police-intervene-as-ruling-party-supporters-face-off-against-anti-government-protesters,"Serbian riot police clash with an anti-government protester in Belgrade on August 13, 2025.

One of your browser extensions seems to be blocking the video player from loading. To watch this content, you may need to disable it on this site.

To display this content from YouTube, you must enable advertisement tracking and audience measurement.

Supporters of the ruling Serbian Progressive Party (SNS) threw flares and firecrackers at anti-government protesters in Novi Sad on Wednesday evening, prompting police to intervene to end the standoff, a major escalation of nine-month-long protests in Serbia.

The student-led protests in Serbia first started in November after a train station canopy collapsed in Novi Sad, killing 16 people and triggering accusations of corruption in state infrastructure projects.

Protests have since drawn hundreds of thousands of people, shaking President Aleksandar Vucic’s firm grip on power. His supporters have recently started organising counter-demonstrations, fuelling fears of possible violence.

Read moreWhy has the EU kept silent on Serbia’s massive protest movement?

At a news conference late on Wednesday, Vucic, flanked by Interior Minister Ivica Dacic, said 16 police officers and around 60 SNS backers have been injured in Novi Sad. He also accused unidentified foreign powers of orchestrating riots and pledged arrests.

""Persons who violated the law will be apprehended ... Tonight, we have averted a catastrophic scenario planned by someone from abroad,"" he said.

Vucic did not provide evidence to substantiate his allegations.

Footage by private N1 TV showed flares and firecrackers being thrown at protesters in Novi Sad from the direction of the SNS offices. It also showed anti-government protesters, some with bloody faces, saying Vucic's backers used sticks and truncheons to attack them.

Protesters then smashed office windows as riot police were deployed outside to guard the building.

Opposition Move-Change movement said Vucic's loyalists have been responsible for the clashes.

""Attacks on people with pyrotechnic devices violate their right to life and protest,"" it said in a statement.

Tens of thousands of protesters rally against populist Serbian government To display this content from YouTube, you must enable advertisement tracking and audience measurement. Accept Manage my choices One of your browser extensions seems to be blocking the video player from loading. To watch this content, you may need to disable it on this site. Try again Protesters demanding early elections clash with police in Belgrade on June 28, 2025. © OLIVER BUNIC / AFP 01:42

In the capital city of Belgrade, police in full riot gear blocked anti-government protesters from approaching the area in a park near the parliament building where Vucic's supporters have been camping since March.

Elsewhere in Belgrade, anti-government protesters clashed with police who prevented them from approaching local SNS offices.

The protesters have blamed corruption for the Novi Sad railway roof collapse and have demanded early elections that they hope would remove Vucic and his party from power after 13 years.

Students, opposition, and anti-corruption watchdogs have accused Vucic and his allies of ties to organised crime, violence against rivals and curbing media freedoms, something they deny.

On Wednesday evening, students who are leading the protests called supporters to protest in front of SNS offices in major cities in Serbia, including Belgrade, Novi Sad, Kragujevac, Cacak and Nis, after several protesters were injured in clashes with SNS in the town of Vrbas on Tuesday evening.

(FRANCE 24 with Reuters and AP)"
‘The West created Vučić’: Serbian journalists say repression is tightening - The Parliament Magazine,https://news.google.com/rss/articles/CBMiuwFBVV95cUxPMW5BZjNGZDl2VmF6Wkc1V0tOVUk2N0MteEYxMnBzcHRoRlo0OW5xT0pTWmlCX2JwUVF2dG53ZzRsclZPYXBEZHdtRlJpeGxta3VJOXBpcDdyQV9weWN4R3ZuRGtxTTgwZDdNNmJIa2JFOXJ5c2VqZUw1T0ZqQUNnOHNaX01hazlpQ0lsUnJyV0ZUN1Jyc1FhaTRLQmxHUVJLYWpQb0pIb0VVdWpUWW5TS3BRMzBWODlPa2VZ?oc=5,The Parliament Magazine,2025-05-21,https://www.theparliamentmagazine.eu/news/article/the-west-created-vui-serbian-journalists-say-repression-is-tightening,"As Serbia cracks down on dissent, investigative reporter Saša Dragojlo talks about state violence, media suppression, and why he thinks the EU bears part of the blame.

Share this page

BELGRADE, Serbia—When Serbian investigative journalist Saša Dragojlo stepped outside his home to document a nearby protest on 23 March, he didn’t expect the attention to turn on him. As tensions flared between citizens and supporters of the ruling Serbian Progressive Party (SNS), Dragojlo began filming. Soon pro-government activists were squaring up to him while the police stood idly by, he says.

Other journalists have suffered more serious attacks. At an SNS rally in Niš on 17 May, SBS radio correspondent Nikola Doderović was detained while reporting. Južne Vesti journalist Tamara Radovanović was also attacked and then removed from the scene by police, who let her attackers continue on.

The Parliament also heard testimony from journalists Dinko Gruhonjic, who says he’s received death threats, and Rijalda Mujezinović, whose father’s car was destroyed by vandals in a village near Prijepolje, in western Serbia. “I felt disturbed because they didn’t do it to me directly here in Belgrade, but they did it to my father. He lives alone and he's unprotected,” she said.

Beyond physical attacks, journalists face increasing government surveillance. An Amnesty International investigation recently found that two journalists from the Balkan Investigative Reporting Network (BIRN) — where Dragojlo also works — were targeted with Pegasus spyware, in the third documented case in two years of Pegasus being used against Serbian civil society.

In Reporters Without Borders’ latest edition of the World Freedom Index, Serbia achieved its lowest score yet, ranking 96th out of 180 countries.

The report said that while Serbia was well regarded in the investigative journalism space, the country is “caught between rampant fake news and propaganda.” Journalists, it added, are vulnerable to “political pressures and crimes committed against them go unpunished.”

President Aleksandar Vučić has consistently disparaged independent media outlets, according to Freedom House — echoing rhetoric employed by many of his right-wing counterparts across Europe.

Against this backdrop, Serbia’s candidate status for EU accession has upset European lawmakers who say the bloc should not be opening its doors to a leader who takes an authoritarian stance on media, the rule of law and the judicial system, all while deepening ties with China and Russia.

Vučić is also under pressure at home. In November, a train station canopy collapsed in Novi Sad, killing 16 people and sparking nationwide anti-corruption protests.

Dragojlo spoke to The Parliament about his experience, the media, the state of democracy in Serbia today — and the role the EU has to play in it all.

The following interview has been edited for length and clarity.

What happened to you when you were filming the protest in March?

It was a hectic day in Belgrade. There were a lot of tensions between the people in the city and the SNS activists. A crowd gathered close to where I live, and I heard from someone that there were hooligans present. At one point, there was a conflict between some SNS activists. I started to film it. At that moment the fuss stopped, the two guys saw me and approached me. They were hostile. I said, “I'm a journalist, I work for BIRN,” and one of the guys became even more aggressive. He said, “Oh, you're a journalist?” and started leaning towards me. His companion pushed him away, but the intent was clear. It was all in front of several police officers, but they didn’t even take his ID. The crowd was chanting asking for the police to react.

Reporters Without Borders published a piece saying the noose was tightening around journalists in Serbia. Do you think that's an accurate portrayal?

Yes. Practically every day we have a situation where journalists critical of the government are being attacked or prevented from doing their job by ruling party activists. The police are always there and they never stop them. They just stand there, allegedly trying to “prevent bigger incidents.” The Vučić regime is becoming more and more aggressive and autocratic because he's losing voters. After so many years he's finally losing voters due to the actions of the student movement and the killing of 16 people last year in Novi Sad. So the atmosphere in society has changed.

Could the decline in media freedom be reversed anytime soon? Could an impartial media regulator be installed?

No, I don't think it's possible. The only way that something will change is if the people who are in power right now also change. They are controlling all the public broadcasters and all the private media. National broadcasting is not independent and it's not even mildly critical of the government. Vučić controls public broadcasters. And that is one of the pillars of his rule. He's just simulating reality.

Parallels are of"
Riot police clash with student-led protesters calling for snap elections in Serbia - Euronews.com,https://news.google.com/rss/articles/CBMiygFBVV95cUxQdzZMSlZKalRzNkxiS3huTXhPMVhsVXZ5VHJIMFJxMi01UWVIMGl2MjBkd3NFY3N6YV8yY3JWUnJtT3RvZUNjVC1aQ1RmWWRwOW12SUMwVkVFQzczUDkwTkJWa19qYXZXcXBIVEtGV1hjQTVKMWQzclN5d0tmR0I0UXlnYURGMlk5aVFxZE5RR3AwVHg0RVRseW1pUi1QUkhwbTdRcnN1TkFkUmhHNzFQZ2wzdy1tZWluN244YVltR3pvTV96a1kxTlB3?oc=5,Euronews.com,2025-06-28,https://www.euronews.com/my-europe/2025/06/28/student-led-anti-government-protest-in-serbia-calls-for-early-parliamentary-election,"ADVERTISEMENT

Riot police clashed with anti-government student-led demonstrators who rallied in the Serbian capital of Belgrade on Saturday to demand early parliamentary elections after nearly eight months of protests.

The students have been a key force in driving anti-corruption protests across the nation following the deadly collapse of a newly renovated train station canopy in the city of Novi Sad in November 2024, which killed 16 people.

Many Serbians blamed the collapse on alleged government corruption and negligence in state infrastructure projects, leading to recurring mass protests.

The huge crowd chanted “We want elections!” as they filled the capital’s central Slavija Square and several blocks around it, with many unable to reach the venue.

Several protesters were handcuffed by police, and an officer was seen injured on the ground during the ongoing street battles. It was unclear whether others were injured.

As the protest formally ended, the demonstrators threw eggs, plastic bottles and other objects at riot police who were preventing the crowd from approaching a downtown park.

Serbian police said 36,000 people were present at the start of the protest Saturday.

An independent monitoring group that records public gatherings said around 140,000 people attended the student-led rally.

Serbian President Aleksandar Vučić and his ruling Serbian Progressive Party (SNS) have rejected calls for early elections, accusing protesters of seeking to incite unrest under foreign influence without providing evidence.

People walk under a large Serbian flag during of a major anti-government rally pressing for an early election after nearly eight months of almost daily anti-corruption demonst Darko Vojinovic/Copyright 2025 The AP. All rights reserved

Despite the government's demands for the protests to end, the large turnout at Saturday’s rally suggested that public anger persisted.

Hours before the student-led rally, the ruling SNS party bused in scores of its own supporters to Belgrade from other parts of the country, many wearing T-shirts reading: “We won’t give up Serbia.”

They were joining a camp of pro-government protesters in central Belgrade, where they have been staying in tents since mid-March.

Presidential and parliamentary elections in Serbia are scheduled for 2027.

Although Vučić and the SNS-led government have repeatedly stated that they want Serbia to join the European Union, Belgrade still maintains good relations with Russia and China."
