title,url,source_name,date_found,actual_url,text
"New protests and incidents throughout Serbia: SNS premises demolished, pyrotechnic devices, tear gas, arrests - KoSSev",https://news.google.com/rss/articles/CBMizwFBVV95cUxQb2lDT2VGN2RWeDU3QWFTR0tDemdEdEJtaklhY3locDJkcElJMTJIOGlLUFFIeE9KVTBlMWx1RjZUeUxqbzJaOVRObWwwb0ZWYmxGVFhvREd6UEotVzh2T2R1MkVncmxldUNHLUJseDBKQ1FBVGV5Y3N2MUpreVRKclhBa0MzcFdwNUdxNW40c2Vkb0x4TnRqVnBZRlRXYXJxZVE3ZFZOWDVxdmxDR0ctd1IyRlNjY0pjNzJIUWFqVGg4cFNteEYtdHRLdVZMVWM?oc=5,KoSSev,2025-08-14,https://kossev.info/en/novi-protesti-sirom-srbije-prostorije-sns-a-demolirane-u-n-sadu-pirotehnicka-sredstva-ka-gradjanima-u-beogradu/,"The news has been updated

At the invitation of the students, numerous citizens took to the streets of cities throughout Serbia tonight. Protests are held in several locations in Belgrade, as well as in Novi Sad, Kraljevo, Valjevo, Smederevo, Kruševac, Aranđelovac and other cities. After numerous incidents throughout Serbia that marked the previous night, the situation in the first part of the evening was calm. However, everything changes after 21.00, when incidents begin to be recorded in several cities. In Novi Sad, the SNS premises were demolished, while the police then used tear gas. In Belgrade, pyrotechnics were fired at citizens near the General Staff. A large number of officers with shields intervened in New Belgrade and other parts of the capital, throwing tear gas and suppressing citizens. And while numerous accusations of excessive use of force are coming again, the MUP says - ""we prevented the attacks"".

Follow the events of the protests live here

Belgraders began to gather
The people of Belgrade gathered tonight at three locations - near the General Headquarters in Nemanjina, near the roundabout near GO Novi Beograd and at Autokomanda.

Hundreds of students and citizens blocked traffic tonight at the corner of Kneza Miloša and Nemanjina streets, between the buildings of the Serbian government and the former General Staff, as part of the ""You're shooting at the seams tonight"" protest.

The gathered people came out to the road around 19.40:XNUMX p.m. and made noise by blowing whistles.

Another group of citizens gathered at the SNS premises in Kneza Milos, where they were met by a cordon of the Gendarmerie.

Cyclist arrested - threw ""shiptar"" at SNS supporters
A cyclist was arrested in this street tonight while he was passing by and threw at SNS supporters. As he himself confirmed to the gathered people who were filming him, while the policeman held him against the asphalt - ""he called out 'Shiptari' with his t-shirts.""


Poles
In front of the headquarters of this party were their activists, and tonight there was a conflict, mostly verbal, between demonstrators and SNS activists, as well as demonstrators and the police.

And while on one side there is a group of citizens who are protesting, on the other side, behind the cordon, in Knez Miloš, there is a group of men with wooden clubs in their hands, the Green-Left Front announced on its X profile.

As can be seen in the video, it is about younger men who are mostly dressed in black, and most of them are holding wooden bats in their hands.



Pyrotechnics fired at citizens
At one point, pyrotechnic devices were fired en masse at the citizens at the General Staff.

Flares, plastic bottles and firecrackers flew from the direction of the progressives.

The gendarmerie pushed the demonstrators closer to the Government of Serbia, and the SNS activists remained positioned in front of that party's premises in Knez Miloš.

During the firing of the pyrotechnics, the Gendarmerie was between the two groups.



After firing pyrotechnic devices at the citizens, the police began to suppress the citizens. In the meantime, there was a physical confrontation between two groups of citizens.

The video shows how several men wearing caps and dressed in black, with their faces covered, start chasing a young man.

Other men approach him from the other direction of the street and try to defend him.

At one point, the men with caps, in black T-shirts and with their faces hidden start to retreat, and the young man they were chasing managed to escape.

The Freedom and Justice Party announced that its MP Peđa Mitrović was beaten at a protest in Belgrade.



Tear gas in New Belgrade, the police repress the demonstrators

A little after 22.00:XNUMX, the situation in New Belgrade heated up when the police started throwing tear gas to disperse the citizens gathered in John Kennedy Street, where the SNS municipal board is located.

After the tear gas, the citizens started to run back, to the parts where the buildings are.

Officers with shields then used tear gas again on several occasions, including against smaller groups of citizens, after which they started an action to suppress the demonstrators.

The police also threw tear gas at Slavija, after which they pushed the demonstrators in the direction of Njegoševa Street.

And in Novi Sad, gatherings, demolished premises of SNS



Citizens are also gathering tonight in Novi Sad, in front of the premises of the Security and Information Agency in that city.


Part of the crowd came in front of the premises of the Serbian Progressive Party, where there were no activists of this party tonight.

Tonight, after 21.00:XNUMX, however, one group broke the glass and demolished the party's premises. They brought out chairs and other items at one point. Previously, eggs and oysters flew, the media write.



Part of the demonstrators then demolished the premises of the Serbian Progressive Party in Stražilovska, where yesterday was the first pyrotechnic attack on citizens by progressives in Novi Sad.

The police also used tear gas in Novi Sad
After citizens in Novi Sad headed towards Kosovska Street, where the SNS premises are located, the police responded for the first time after three hours.



Demonstrators also demolished the premises of the SNS there, and the police chased away the citizens who were heading towards the premises of the SRS.

The police threw tear gas at the citizens. Masked men from the crowd threw firecrackers at the cordon.



Citizens in Niš throw eggs at the Gendarmerie
The citizens of Nis also used eggs tonight. They gathered in front of the building of the City Assembly, and then they threw eggs at the cordon of the Gendarmerie, he reports N1.



Citizens chanted at them ""arrest Vučić"", ""lower your shields"", ""have you been trained for this"".



Tense in Pancevo too
Incidents were also recorded in Pancevo tonight. A large number of citizens gathered in the streets to protest in front of the SNS headquarters.

However, police cordons have been set up in nearby streets to prevent citizens from doing so, reports the agency Beta.

At one point, after pyrotechnic devices were thrown, the police used force against the demonstrators who tried to break through the barricade several times during the evening, throwing eggs, plastic bottles and other objects at the police.

Police also threw tear gas at citizens in Valjevo
Several hundred residents of Valje gathered tonight at the ""Romana"" cafe in Hajduk Veljkova Street, whose owner was beaten last night by masked thugs, and the cafe window and part of the inventory were broken.

Tonight, the demonstrators stood calmly in front while the police cordon was located at the corner of Čika Ljubina Street and prevented the passage to the headquarters of the Serbian Progressive Party (SNS) in Valjevo, writes N1.

At one point, cannon shots were heard and the police started pushing the demonstrators towards Karađorđeva Street. At one point, tear gas was also thrown. Demonstrators were further pushed along Karađorđeva Street towards the city center.

Clips with allegations of police brutality are circulating on social networks.

""Survival of the police over the people who were arrested and on the ground,"" announced the Move-Change Movement.



SNS activists in Vrbas on the eve of the citizens' protest
In contrast to Novi Sad, SNS supporters gathered tonight in front of that party's premises in the center of Vrbas, on the eve of the protest called by the Vrbas Students' Voice association.

In this city, during the day, five citizens were arrested, who were at a civil protest in that place on Tuesday evening, he reported. N1.



The Democratic Party announced that their member Vukašin Vujičić was arrested in Vrbas for ""participating in a peaceful protest"" in that city.

Protests in other cities as well.
Citizens are also gathering in Kruševac tonight. The Citizens' Assembly called for a protest.

The citizens of Kruševac started a protest walk from the SNS premises to the mansion of Defense Minister Bratislava Gašić, writes Today.

The gatherings are being held in Zrenjanin, as well as Arandjelovac, because of yesterday's arrest of student Dunja Joksić and her parents, who were then released.
Like last night, members of the intervention unit in Čačak surrounded the premises of SNS in the city center and it is impossible to reach them.

According to Nova reporter, the police are at four to five locations in the city, and more than 2.000 citizens have gathered.



In Kraljevo, the citizens have reached the last point - before the premises of the SNS, from where it is impossible to go any further.

As the N1 reporter reports, the police with batons blocked Cara Lazar Street, where the offices of the SNS and the Police Department are located.

Activists of SNS gathered tonight in front of the party premises in Smederevo. And there the policemen formed a cordon.

Dacic: At least 14 people were arrested, five police officers were injured
As during last night's incidents, the Minister of Internal Affairs, Ivica Dacic, also addressed the public tonight with allegations that the police reacted to prevent the attacks.

At least five police officers were injured, and 14 people have been arrested so far for the attack on the police, Dacic said.

The minister emphasized that all rioters will be identified and detained, and that the police will establish public order and peace.

""These kinds of attacks on the police have not been recorded for many years. The police are there to ensure public order and peace, and they acted exclusively for that purpose and for the purpose of defense. The biggest incidents and the burning and destruction of SNS premises were in Novi Sad. As well as the police. In Belgrade, the police were attacked in the streets around the Government of Serbia and in New Belgrade,"" said Dacic.

Vučić counts: 3.100 people in Belgrade

The President of Serbia, Aleksandar Vučić, said tonight that there were a total of less than 3.100 people at the protests in Belgrade and that there will be many more arrests than yesterday.

""Some of our state bodies are not able to react as needed, but I think it is good that tonight there were no members of the Serbian Progressive Party in their party premises,"" Vučić told television. Inform, on the occasion of the intrusion of demonstrators into the SNS premises in Novi Sad.

""Organized and brutal violence""
After numerous incidents in the previous days, students, professors, part of the public and certain organizations continue to criticize the highest representatives of the government, SNS and MUP, accusing the regime of violence.

University networks from Novi Sad, Belgrade, Niš, Kragujevac, Novi Pazar and Kosovska Mitrovica today condemned the ""organized and brutal violence"" that has been perpetrated against citizens throughout Serbia for days, and which, they say, is organized by criminal groups linked to the Serbian Progressive Party, with the full logistical and operational support of the Ministry of Internal Affairs of Serbia (MUP).

""Intimidation, physical attacks, the use of pyrotechnics and the pulling of guns on unarmed citizens - as happened in Novi Sad - are a clear sign that the state is captured, and the institutions have been turned into an instrument of repression by one political party,"" said the joint statement of those networks.

It is also warned that the MUP has been turned into the private security of the ruling elite, which does not protect the law but ""the criminal government from citizens"".

They also add that Serbia is no longer a democratic country, because it stifles freedom of speech, distorts facts, prohibits assembly and violently tramples on basic human rights.

Students in the blockade of Novi Sad FTN called on the Serbian Army to stand with the people
The students in the blockade of the Novi Sad Faculty of Technical Sciences (FTN) today called on the Serbian Army to stand with the people.

""We call on all honorable veterans of the Army to remember that the people's trust in the Army has always been unquestionable and that now is not the time to betray that trust,"" they said on Instagram.

They call on the army to resist ""the yoke of those who act like occupiers in their own country, those who want to put everything Serbian under their control and bring it in for personal gain.""

""Don't let your uniform become a tool in the hands of those who see people only as an obstacle,"" said the students at the FTN blockade.

On the occasion of last night's incidents in Novi Sad and the official confirmation that members of ""Cobra"" were also present at the protest, students asked ""who ordered the elite military forces to be deployed among the party ranks?""



Belgrade Center for Human Rights: Police protected the safety of SNS members only
The Belgrade Center for Human Rights today condemned the ""biased and discriminatory behavior of the police"", which, especially during the recent protests by citizens throughout Serbia, ""stood aside and protected the safety of exclusively members of the Serbian Progressive Party (SNS)"".

EC: The EU strongly condemns all forms of violence, including threats to journalists in Serbia
The European Union is closely monitoring the situation in Serbia after several protests in Serbia, during which demonstrators and journalists were reportedly attacked and intimidated by supporters of the ruling party, while the police did not react.

On Question N1 when the European Commission will become more actively involved in the protection of human rights, as well as the protection of journalists, the spokesperson of that institution said that the European Union ""strongly condemns any form of violence, including threats to journalists"" and calls for ""an end to any escalation of tensions"".

Marta Kos condemned the attacks on citizens and journalists at protests in Serbia
European Commissioner for Enlargement Marta Kos said that the reports of violence during the recent protests in Serbia are very worrying.

""Reports of violence during the recent protests in Serbia are very worrying. Progress towards the EU requires citizens to be able to express their views freely and journalists to be able to report without intimidation or attack,"" Kos wrote on the X network.

ProGlas: Vučić and Dacić most responsible for violent events on the streets
ProGlas and the Association of Free Organizations of Serbia (SOS) believe that Aleksandar Vučić and Ivica Dacić are most responsible for violent events on the streets of Serbian cities, ProGlas announced."
Marko Stojić for NIN: The government lives in fear of accountability - NIN.rs,https://news.google.com/rss/articles/CBMiqAFBVV95cUxOZWVMazE0SGs5ZkVYVGNhelB4alN6R3IxTkZiQkd0Z3lhcmFvX1ItSVpVZXQ4d0diOHM3b0FkRWNnWlRsUVZ4RzdMSExIZUNid1Naa3J0VnZ1aGFWOGlUdkp6djk3OTFOZGVTcHE3ekg0ZkVTTmRVdnpNRGY2QW81RHZXQXNRWEg5TWxjOTctY3JManBkRk9kR2M0QnF3Z2h1ODVrQmJqLXM?oc=5,NIN.rs,2025-08-20,https://www.nin.rs/english/news/86641/marko-stojic-for-nin-the-authorities-live-in-fear-of-accountability,"In democratic countries, elections are the only acceptable institutional means to resolve deep social conflicts and to exit crises. Therefore, it is essential for the authorities to reduce tensions and initiate a genuine dialogue with the protesting citizens in order to find a sustainable path out of the crisis, says Marko Stojić, a professor in the Department of International Relations and European Studies at the Metropolitan University in Prague, in an interview with NIN.

Stojić, who specializes in European integration, EU enlargement, political parties, and Euroscepticism, also discussed the relationship between Serbia and the EU, as well as the dynamics within the Union.

The political situation in Serbia is extremely tense, the society is divided into two increasingly distant camps. How does a political scene arrive at such a situation, is there a way out of it, and what are the options?

Serbia is currently experiencing a profound institutional, political, and social crisis. The protests that have been shaking the country for months represent the culmination of 13 years of rule by the Serbian Progressive Party (Srpska napredna stranka - SNS), a party that is undoubtedly corrupt and increasingly and obviously criminalized. In an atmosphere of immense distrust in the state apparatus and in a situation where functional democratic institutions have long been absent, civil unrest is a genuine cry from society for justice. The protesting citizens are demanding truth and accountability, and the greatest responsibility naturally falls on those who have held absolute power for years.

In democratic countries, elections are the only acceptable institutional means to resolve deep social conflicts and to exit crises. Therefore, it is essential for the authorities to reduce tensions and initiate a genuine dialogue with the protesting citizens in order to find a sustainable way out of the crisis. Primarily, this would mean reaching an agreement to ensure minimum conditions for holding elections, given that the SNS will do everything in its power to prevent fair elections. This party has spent over a decade establishing its political dominance by using mechanisms that allow it to win elections in advance, controlling the voter registry, the media, the public sector, and financial flows. The party will clearly not relinquish its most crucial sources of power.

However, experience shows that there are very few voices of reason within the government. The authorities live in fear of accountability. After years of accusations of corruption, criminal scandals, and the erosion of institutions, even elections under unfair conditions could lead to a loss of power and raise issues of political and even criminal responsibility for party leaders. In such circumstances, preventing the electoral competition ceases to be a matter of democracy and procedure, becoming instead a matter of mere political survival.

What is your view on the relationship between Serbia and the EU? The accession process has effectively stalled for a long time. What are the main reasons for this, and can it change?

Currently, Serbia is merely a formal candidate for EU membership. In reality, the country has never been as far from membership since 2014, when the accession negotiations began. The last negotiating chapter was opened in December 2021, and there is almost no possibility of the process being unblocked anytime soon. The country finds itself in an undeclared suspension of negotiations with the EU, with the European Commission refraining from formally proposing a suspension so as not to weaken the fragile pro-European forces, to avoid losing at least symbolic influence over the situation in the country, and to prevent further malign influence from Russia.

I believe that the EU has demonstrated a high degree of confusion and misunderstanding of the complex circumstances under which the Western Balkans is approaching the Union. This was particularly evident when the Commission and leading member states supported the controversial ""Jadar"" project by the company ""Rio Tinto."" Such moves further undermined the already fragile credibility of the EU and compromised the ""European idea"" in Serbia – even among the staunchest supporters of integration.

The fundamental reason for the substantive halt in Serbia's European integration, however, is the fact that the authorities have no intention, let alone interest, in working towards the country's accession to the EU. It is now clear that Serbia, under the rule of the Serbian Progressive Party, will not become a member of the Union. On the contrary, the country has been moving further away from meeting the basic membership criteria for over a decade – and will accelerate this process after the end of 2024.

Throughout this year, Serbia has dramatically regressed in key areas essential for EU accession: functional democracy, human rights, and the rule of law. Institutions ""captured"" by the ruling party have n"
"Serbia sees violent clashes between Vucic supporters, protesters - The New Voice of Ukraine",https://news.google.com/rss/articles/CBMirgFBVV95cUxPS0RaNVpEVnJMX0RUTjhHMDNGNWhEVU8yaXlFay1QQVoyM3pXLVVPenJlRUVTMU5GeUZQM0F1YU1RMzdScWNidHVZSXNJVGQ1WU9iOGFLemhaNkNBNzg3OGdzdjlma01oTGljaWxkRVN0THRxN2prV3M4eDEwM0xKQ2d3ZkRObktqeXNPVl9IWXFEZHZ2Mk00TWY1X1p1ODRoTS1XR0VIai1uVC1uaUHSAaoBQVVfeXFMTmFyTFRiaTNLNkZ6aFZlYjZ0dkJ0b0k5c0ZIZXN0Ti1nRTd6T01YWHNiM1AxSzZ5b1d4TDlhNWw5akYzcU5Xc0lacldYOVFtWTMxaDZueDNMLWJfR2JYWjFGUEdxaDlJel8wMnR5UFZWRXNFeXZaT3dldjB4MzZzNG9sMUpYNjFINUZjUURRZ1BDd3A2c0x5TVQzNmVUc1hlQk9GTHQ1YmtwMWc?oc=5,The New Voice of Ukraine,2025-08-14,https://english.nv.ua/nation/protests-in-serbia-clashes-in-belgrade-and-novi-sad-dozens-injured-50537047.html,"Clashes broke out in several Serbian cities on Aug. 13 during protests against President Aleksandar Vucic, involving anti-government demonstrators, his supporters, and security forces, German broadcaster DW reports.

Vucic stated that in Novi Sad alone, preliminary reports indicate 64 locals and about 15 police officers were injured.

The Tanjug news agency reported that Vucic emphasized the need to prevent a “civil war” and “clear” the streets of Belgrade and Novi Sad of “hooligans and murderers.”

REUTERS/Djordje Kojadinovic
Photo: REUTERS/Djordje Kojadinovic
REUTERS/Djordje Kojadinovic
Photo: REUTERS/Djordje Kojadinovic
In Belgrade and Novi Sad, government supporters attacked opponents with fireworks, while police used tear gas.

Read also:

Serbia's flag (Photo: apakom / Pixabay)
Explosion rocks Serbian ammo plant, two workers injured
Reuters reported that footage from private television channel N1 showed supporters of the ruling Serbian Progressive Party (SNS) throwing flares and firecrackers at protesters in Novi Sad. Anti-government demonstrators, some with bloodied faces, claimed Vucic’s supporters used sticks and batons to attack them.

REUTERS/Djordje Kojadinovic
Photo: REUTERS/Djordje Kojadinovic
REUTERS/Djordje Kojadinovic
Photo: REUTERS/Djordje Kojadinovic
REUTERS/Djordje Kojadinovic
Photo: REUTERS/Djordje Kojadinovic
In Belgrade, riot police in full gear prevented anti-government protesters from approaching a park near the parliament building, where Vucic’s supporters have maintained encampments since March.

Read also: Serbia must choose between East and West — EU
The protests on Aug. 13, were organized in response to incidents that occurred on Aug. 12 evening in the northwestern town of Vrbas, where police separated protesters from pro-government encampments near the ruling party’s offices.

Russian Realities
Get weekly newsletter in your mailbox bimonthly
Email

Subscribe newsletter
Will you help tell Ukraine’s story to the world?

Twenty years ago, most people hadn’t even heard of Ukraine. Today, the country is on everyone’s lips and everyone’s headlines. War pushed us on the front page. But there are many other things we do that we are proud of – from music and culture to technology.

We need your help to tell the world Ukrainian story of resilience, joy, and survival. If you’re willing to back our effort, consider supporting us on Patreon starting from 5$ per month. We are immensely grateful."
